[
  {
    "id": 1,
    "hospital_id": 3,
    "department_id": 15,
    "full_name": "Dra. Almudena Gras Murcia",
    "specialty": "Trauma Surgery",
    "license_number": "LIC-0000001",
    "email": "almudena.gras@example.org",
    "hired_at": "2020-08-11",
    "qualification": "Dr. en Medicina, Esp. vía MIR"
  },
  {
    "id": 2,
    "hospital_id": 4,
    "department_id": 24,
    "full_name": "Dra. Trinidad Escrivá",
    "specialty": "Orthopaedic Surgery",
    "license_number": "LIC-0000002",
    "email": "trinidad.escriva@example.org",
    "hired_at": "2012-12-17",
    "qualification": "Lic. Medicina"
  },
  {
    "id": 3,
    "hospital_id": 13,
    "department_id": 78,
    "full_name": "Dr. Salomón Lucena Méndez",
    "specialty": "Interventional Cardiology",
    "license_number": "LIC-0000003",
    "email": "salomon.lucena@example.org",
    "hired_at": "2015-06-16",
    "qualification": "Lic. Medicina"
  },
  {
    "id": 4,
    "hospital_id": 15,
    "department_id": 101,
    "full_name": "Dra. Montserrat Arco Cabo",
    "specialty": "Psychiatry",
    "license_number": "LIC-0000004",
    "email": "montserrat.arco@example.org",
    "hired_at": "2012-06-09",
    "qualification": "Dr. en Medicina, Esp. vía MIR"
  },
  {
    "id": 5,
    "hospital_id": 4,
    "department_id": 25,
    "full_name": "Dr. José Antonio Eusebio Saldaña Calatayud",
    "specialty": "Psychiatry",
    "license_number": "LIC-0000005",
    "email": "jose.antonio@example.org",
    "hired_at": "2001-12-25",
    "qualification": "Dr. en Medicina"
  },
  {
    "id": 6,
    "hospital_id": 12,
    "department_id": 72,
    "full_name": "Dra. Noa Galvez Palomo",
    "specialty": "Neurosurgery",
    "license_number": "LIC-0000006",
    "email": "noa.galvez@example.org",
    "hired_at": "2017-05-25",
    "qualification": "Dr. en Medicina"
  },
  {
    "id": 7,
    "hospital_id": 13,
    "department_id": 86,
    "full_name": "Dr. Graciano Aznar Raya",
    "specialty": "Paediatrics",
    "license_number": "LIC-0000007",
    "email": "graciano.aznar@example.org",
    "hired_at": "2015-06-16",
    "qualification": "Dr. en Medicina"
  },
  {
    "id": 8,
    "hospital_id": 15,
    "department_id": 100,
    "full_name": "Dr. Cleto Reina Pinedo",
    "specialty": "Sports Medicine",
    "license_number": "LIC-0000008",
    "email": "cleto.reina@example.org",
    "hired_at": "2022-06-05",
    "qualification": "Grado en Medicina"
  },
  {
    "id": 9,
    "hospital_id": 16,
    "department_id": 103,
    "full_name": "Dr. Juan Francisco Cerezo Armengol",
    "specialty": "Trauma Surgery",
    "license_number": "LIC-0000009",
    "email": "juan.francisco@example.org",
    "hired_at": "2022-09-19",
    "qualification": "Grado en Medicina"
  },
  {
    "id": 10,
    "hospital_id": 11,
    "department_id": 68,
    "full_name": "Dra. Carla Vicente Mir",
    "specialty": "Child Psychiatry",
    "license_number": "LIC-0000010",
    "email": "carla.vicente@example.org",
    "hired_at": "1988-09-18",
    "qualification": "Lic. Medicina"
  },
  {
    "id": 11,
    "hospital_id": 1,
    "department_id": 1,
    "full_name": "Dra. Nazaret Delgado Falcón",
    "specialty": "Dermatology",
    "license_number": "LIC-0000011",
    "email": "nazaret.delgado@example.org",
    "hired_at": "2000-04-10",
    "qualification": "Dr. en Medicina, Esp. vía MIR"
  },
  {
    "id": 12,
    "hospital_id": 17,
    "department_id": 111,
    "full_name": "Dra. Noa Cuadrado Cabañas",
    "specialty": "Interventional Cardiology",
    "license_number": "LIC-0000012",
    "email": "noa.cuadrado8@example.org",
    "hired_at": "2017-06-22",
    "qualification": "Lic. Medicina"
  },
  {
    "id": 13,
    "hospital_id": 16,
    "department_id": 110,
    "full_name": "Dra. Candela del Fuentes",
    "specialty": "Interventional Radiology",
    "license_number": "LIC-0000013",
    "email": "candela.del@example.org",
    "hired_at": "2024-10-17",
    "qualification": "Grado en Medicina, Esp. vía MIR"
  },
  {
    "id": 14,
    "hospital_id": 17,
    "department_id": 116,
    "full_name": "Dra. Adelia Navarrete-Puga",
    "specialty": "Obstetrics",
    "license_number": "LIC-0000014",
    "email": "adelia.navarrete-puga@example.org",
    "hired_at": "1999-03-01",
    "qualification": "Lic. Medicina"
  },
  {
    "id": 15,
    "hospital_id": 16,
    "department_id": 104,
    "full_name": "Dra. Yéssica Ariño Baeza",
    "specialty": "General Surgery",
    "license_number": "LIC-0000015",
    "email": "yessica.arino@example.org",
    "hired_at": "2019-02-14",
    "qualification": "Grado en Medicina, Esp. vía MIR"
  },
  {
    "id": 16,
    "hospital_id": 5,
    "department_id": 28,
    "full_name": "Dr. Heriberto Piñeiro-Álvarez",
    "specialty": "Dermatology",
    "license_number": "LIC-0000016",
    "email": "heriberto.pineiro-alvarez@example.org",
    "hired_at": "1994-04-12",
    "qualification": "Lic. Medicina"
  },
  {
    "id": 17,
    "hospital_id": 8,
    "department_id": 43,
    "full_name": "Dra. Cayetana Adadia Barreda",
    "specialty": "Trauma Surgery",
    "license_number": "LIC-0000017",
    "email": "cayetana.adadia@example.org",
    "hired_at": "2023-08-07",
    "qualification": "Grado en Medicina, Esp. vía MIR"
  },
  {
    "id": 18,
    "hospital_id": 8,
    "department_id": 50,
    "full_name": "Dr. Narciso Acedo Rosselló",
    "specialty": "Interventional Radiology",
    "license_number": "LIC-0000018",
    "email": "narciso.acedo@example.org",
    "hired_at": "1998-05-27",
    "qualification": "Lic. Medicina"
  },
  {
    "id": 19,
    "hospital_id": 2,
    "department_id": 5,
    "full_name": "Dr. Luís Meléndez Sancho",
    "specialty": "Vascular Surgery",
    "license_number": "LIC-0000019",
    "email": "luis.melendez@example.org",
    "hired_at": "1989-10-15",
    "qualification": "Lic. Medicina"
  },
  {
    "id": 20,
    "hospital_id": 5,
    "department_id": 33,
    "full_name": "Dra. Marina Porcel Cañizares",
    "specialty": "Orthopaedic Surgery",
    "license_number": "LIC-0000020",
    "email": "marina.porcel@example.org",
    "hired_at": "2022-05-17",
    "qualification": "Dr. en Medicina, Esp. vía MIR"
  },
  {
    "id": 21,
    "hospital_id": 3,
    "department_id": 19,
    "full_name": "Dra. Inés del Marin",
    "specialty": "Psychiatry",
    "license_number": "LIC-0000021",
    "email": "ines.del@example.org",
    "hired_at": "2022-05-26",
    "qualification": "Grado en Medicina, Esp. vía MIR"
  },
  {
    "id": 22,
    "hospital_id": 11,
    "department_id": 64,
    "full_name": "Dra. Agustina de Prat",
    "specialty": "Electrophysiology",
    "license_number": "LIC-0000022",
    "email": "agustina.de@example.org",
    "hired_at": "2023-02-26",
    "qualification": "Grado en Medicina"
  },
  {
    "id": 23,
    "hospital_id": 16,
    "department_id": 109,
    "full_name": "Dr. Ruy Belmonte Suárez",
    "specialty": "Paediatrics",
    "license_number": "LIC-0000023",
    "email": "ruy.belmonte6@example.org",
    "hired_at": "2015-01-31",
    "qualification": "Dr. en Medicina, Esp. vía MIR"
  },
  {
    "id": 24,
    "hospital_id": 8,
    "department_id": 45,
    "full_name": "Dra. Nayara Tejero Franco",
    "specialty": "Endocrinology",
    "license_number": "LIC-0000024",
    "email": "nayara.tejero@example.org",
    "hired_at": "2023-06-12",
    "qualification": "Dr. en Medicina"
  },
  {
    "id": 25,
    "hospital_id": 12,
    "department_id": 70,
    "full_name": "Dra. Carmelita Pujol",
    "specialty": "Vascular Surgery",
    "license_number": "LIC-0000025",
    "email": "carmelita.pujol@example.org",
    "hired_at": "2022-06-21",
    "qualification": "Dr. en Medicina"
  },
  {
    "id": 26,
    "hospital_id": 13,
    "department_id": 86,
    "full_name": "Dra. Abril Almazán Granados",
    "specialty": "Paediatrics",
    "license_number": "LIC-0000026",
    "email": "abril.almazan@example.org",
    "hired_at": "2018-10-30",
    "qualification": "Dr. en Medicina"
  },
  {
    "id": 27,
    "hospital_id": 4,
    "department_id": 23,
    "full_name": "Dra. Chita Estévez Marqués",
    "specialty": "Neurosurgery",
    "license_number": "LIC-0000027",
    "email": "chita.estevez@example.org",
    "hired_at": "2017-05-21",
    "qualification": "Lic. Medicina, Esp. vía MIR"
  },
  {
    "id": 28,
    "hospital_id": 12,
    "department_id": 77,
    "full_name": "Dr. Salvador Coello Real",
    "specialty": "Interventional Radiology",
    "license_number": "LIC-0000028",
    "email": "salvador.coello@example.org",
    "hired_at": "1995-12-18",
    "qualification": "Lic. Medicina, Esp. vía MIR"
  },
  {
    "id": 29,
    "hospital_id": 1,
    "department_id": 4,
    "full_name": "Dra. Clotilde Vilar Castelló",
    "specialty": "Haematology",
    "license_number": "LIC-0000029",
    "email": "clotilde.vilar9@example.org",
    "hired_at": "2021-06-05",
    "qualification": "Grado en Medicina, Esp. vía MIR"
  },
  {
    "id": 30,
    "hospital_id": 4,
    "department_id": 21,
    "full_name": "Dra. Amor Iglesia-Águila",
    "specialty": "Dermatology",
    "license_number": "LIC-0000030",
    "email": "amor.iglesia-aguila@example.org",
    "hired_at": "2021-02-23",
    "qualification": "Dr. en Medicina"
  },
  {
    "id": 31,
    "hospital_id": 8,
    "department_id": 46,
    "full_name": "Dr. César Velasco Pont",
    "specialty": "Neurology",
    "license_number": "LIC-0000031",
    "email": "cesar.velasco@example.org",
    "hired_at": "2000-10-29",
    "qualification": "Lic. Medicina"
  },
  {
    "id": 32,
    "hospital_id": 2,
    "department_id": 8,
    "full_name": "Dra. Claudia Navarrete-Piñol",
    "specialty": "Obstetrics",
    "license_number": "LIC-0000032",
    "email": "claudia.navarrete-pinol@example.org",
    "hired_at": "2018-07-17",
    "qualification": "Grado en Medicina, Esp. vía MIR"
  },
  {
    "id": 33,
    "hospital_id": 10,
    "department_id": 59,
    "full_name": "Dra. Maite Luisa Egea Benet",
    "specialty": "Internal Medicine",